{
  "id": "translation",
  "name": "多语言翻译",
  "version": "1.0.0",
  "description": "即时文本与词汇翻译、双语词典释义、发音试听、例句对照与一键复制",
  "category": "action",
  "tags": [
    "翻译",
    "英译中",
    "中译英",
    "词典",
    "多语言",
    "发音",
    "查词",
    "Translate"
  ],
  "agentHint": {
    "functionality": "智能识别跨语言翻译、词义释义与外语查询需求，提供双向互译、音标发音、双语例句与词性拓展",
    "bestFor": [
      "用户搜索内容包含'翻译'、'英文'、'英语'、'日语'、'韩语'、'怎么说'、'什么意思'等",
      "外语词汇查询（如'苹果的英文'、'人工智能英语'、'hello中文'）",
      "双语对照与即时语音试听"
    ],
    "dataRequirements": [
      "待翻译文本或目标语言"
    ],
    "selectionHeuristics": "当搜索词涉及中英日韩等多语言翻译或词汇查询时，必须优先启用并置顶展示",
    "triggerKeywords": [
      "翻译",
      "英文",
      "英语",
      "日语",
      "韩语",
      "法语",
      "德语",
      "西语",
      "俄语",
      "translate",
      "translation",
      "怎么说",
      "什么意思",
      "英译中",
      "中译英"
    ]
  },
  "icon": "Languages",
  "grid": {
    "width": 50,
    "supportedWidths": [
      50,
      75,
      100
    ],
    "ratio": "3:2",
    "minWidth": 25,
    "height": "auto",
    "ratioMode": "flexible"
  },
  "layout": {
    "defaultWidth": 50,
    "minWidth": 25,
    "maxWidth": 100,
    "preferredRoles": [
      "primary",
      "hero"
    ],
    "canPairWith": [
      "takeaways",
      "related_links"
    ]
  },
  "theme": {
    "accentColor": "#6366f1"
  }
}
