{
  "$schema": "./widget-manifest.schema.json",
  "id": "image_gallery",
  "name": "相关图片",
  "version": "1.0.0",
  "description": "聚合全网检索结果中的相关图片，以自适应网格呈现，支持点击放大预览与图源溯源",
  "presence": "conditional",
  "category": "analysis",
  "tags": [
    "相关图片",
    "图片墙",
    "视觉素材",
    "缩略图",
    "图集",
    "媒体预览",
    "配图参考"
  ],
  "agentHint": {
    "functionality": "提取全网检索结果中的图片缩略图与研报配图，以自适应网格墙呈现，支持点击放大预览、图文对照与一键跳转图片原始出处",
    "bestFor": [
      "查询对象具有明确可视形态：人物、地点、动植物、产品外观、界面截图、艺术作品",
      "需要图片素材、配图灵感或实物外观确认的场景",
      "百科介绍类检索希望直观看到实物、场景与效果图"
    ],
    "dataRequirements": [
      "检索结果中包含可公开访问的图片缩略图，或研报 Markdown 内嵌配图",
      "图片与查询主题相关且可正常加载"
    ],
    "selectionHeuristics": "当查询对象具备明确视觉形态（实物 / 人物 / 地点 / 界面 / 图表）且检索信源含图片时实用性最高；纯抽象概念推演、代码报错排查、无任何图片信源的任务不推荐选取。",
    "triggerKeywords": [
      "图片",
      "照片",
      "图集",
      "壁纸",
      "素材",
      "外观",
      "长什么样",
      "图片搜索"
    ],
    "antiPatterns": [
      "纯抽象概念解释、术语定义与代码报错排查",
      "检索结果中不含任何可用图片信源的长文研报"
    ]
  },
  "icon": "Images",
  "grid": {
    "width": 75,
    "supportedWidths": [75],
    "ratio": "4:3",
    "minWidth": 75
  },
  "layout": {
    "defaultWidth": 75,
    "minWidth": 75,
    "maxWidth": 75,
    "preferredRoles": ["primary", "secondary"],
    "canPairWith": ["takeaways", "token_usage", "related_links"]
  },
  "theme": {
    "accentColor": "#ec4899",
    "flipAnimation": "3d-flip"
  }
}
